"Krishnarathi, A, and S Suthakar Isaac. “Food and Feeding Ecology of Bat Preferred Plant Species and Their Mutualistic Interactions in Tirunelveli District,” 2016.",1,,,,,,,,,,,,,,,,,,,,,,,,,,,,,,,,,,,1,,,,,,,,,,,,,,1,,,,,,,,,,,,,,,,,,,,,,,,,,,,,,,,,,,,,,,,,,,,,,,,,,,,,,,,
"Ashwin, Cheruthottunkara Purushothaman, and Samidurai Jayakumar. “Diet of Indian Flying Fox Pteropusgiganteus(Brünnich, 1782) in Selected Districts of Kerala and Tamil Nadu, India,” n.d.",1,,,,,,,,,,,,,,,,,,,,,1,,,,,,,,,,,,,,1,,,,,,,,,,,1,,,,,,,,,,,,,,,,,,,,,,,,,,,,,,,,,,,,,,,,,,,,,,,,,,,,,,,,,,,
"Vanlalnghaka, C. “Seasonal Variation in the Diet of the Frugivorous Bat, Rousettus Leschenaultia,” 2015
",1,,,,,,,,,,,,,,,,,,,,,,,,,,,,1,,,,,,,,,,,,,,,,,,,,,,1,,,,,,,,,,,,,,,,,,,,,,,,,,,,,,,,,,,,,,,,,,,,,,,,,,,,,,,
"Mahandran, Valliyappan, Hanumanthan Raghuram, and Parthasarathy Thiruchenthil Nathan. “Geophagy by the Indian Short-Nosed Fruit Bat, Cynopterus Sphinx (Pteropodidae) While Foraging on Madhuca Latifolia (Sapotaceae) in Tamil Nadu, South India.” Acta Ethologica 19, no. 1 (February 2016): 95–99. https://doi.org/10.1007/s10211-015-0227-7.",1,,,,,,,,,,,,,,,,,,,,,,,,,,,,,,,,,,,1,,,,,,,,,,,,,,1,,,,,,,,,,,,,,,,,,,,,,,,,,,,,,,,,,,,,,,,,,,,,,,,,,,,,,,,
"Juliet Vanitharani. “Latidens Salimalii (Endemic, Endanger Fruit Bat) A Reliable Propagator of Endemic Trees of Southern Western Ghats.” Journal of Life Sciences 9, no. 9 (September 28, 2015). https://doi.org/10.17265/1934-7391/2015.09.004.",1,,,,,,,,,,,,,,,,,,,,,,,,,,,,,,,,,,,1,,,,,,,,,,,,,,,1,,,,,,,,,,,,,,,,,,,,,,,,,,,,,,,,,,,,,,,,,,,,,,,,,,,,,,,
